文本;群体情绪;时间
珠海发生驾车冲撞市民重大恶性案件：35人死亡43人受伤;0.0004656641318713895;2024-11-12 12:04:34
习近平对广东珠海市驾车冲撞行人案件作出重要指示强调 全力救治伤员 依法严惩凶手 加强风险源头防控 严防发生极端案件 李强作出批示;0.7531192813136592;2024-11-12 11:29:23
习近平对广东珠海市驾车冲撞行人案件作出重要指示。@快手热点(O3xddgkd5fav5if9) @快手普法(O3xf8akief9qng7w) # #法律  #法治社会 #史利伟公益普法;0.0016862349619094768;2024-11-12 11:33:40
通报：珠海驾车冲撞市民重大恶性案件造成35人死亡，43人受伤;0.006131546900610476;2024-11-12 11:33:26
珠海驾车冲撞市民重大恶性案件造成35人死亡、43人受伤;0.009176171394521426;2024-11-12 15:23:44
习近平对广东珠海市驾车冲撞行人案件作出重要指示。  ;0.00664476474729366;2024-11-12 12:04:21
#珠海市驾车冲撞行人案件伤者正在全力救治，43人受伤仍在院治疗;-0.008241448960863682;2024-11-12 11:40:34
习近平对广东珠海市驾车冲撞行人案件作出重要指示强调 全力救治伤员 依法严惩凶手 加强风险源头防控 严防发生极端案件;1.0;2024-11-12 11:31:40
11月11日19时48分许，珠海发生一起驾车冲撞市民重大恶性案件。12日，珠海市公安局发布警情通报，案件致35人死亡，43人受伤。;0.00014693400200316569;2024-11-12 11:55:34
珠海11日晚发生驾车冲撞市民重大恶性案件：35人死亡，43人受伤   ;0.6951072200841495;2024-11-12 15:22:45
珠海驾车冲撞市民重大恶性案件造成35人死亡，43人受伤;0.010587138193883936;2024-11-12 15:18:51
广东珠海一男子驾车撞倒多人后逃逸，警方通报：伤者已送医，涉事司机已被控制（来源：珠海市公安局香洲分局 制作：卢思露） #逃逸  #撞人  #交通  #通报;0.004316330663708369;2024-11-12 15:22:29
珠海警方通报 驾车冲撞行人案件 已造成35人死亡 43人重伤;0.0067849184365346826;2024-11-12 15:22:35
【35人死亡 43人受伤！ #珠海发生驾车冲撞市民重大恶性案件  】2024年11月11日19时48分许，珠海发生一起驾车冲撞市民重大恶性案件。12日，珠海市公安局发布警情通报，案件致35人死亡，43人受伤。（珠海市公安局）;0.018735864441842328;2024-11-12 15:20:31
广东珠海发生驾车撞人重大恶性案件，致35死43伤。;0.004345017285632357;2024-11-12 15:22:32
广东珠海发生驾车撞人重大恶性案件，致35死43伤;0.0012765384011679244;2024-11-12 15:19:12
2024年11月11日19时48分许，珠海发生一起驾车冲撞市民重大恶性案件。12日，珠海市公安局发布警情通报，案件致35人死亡，43人受伤。公安机关组织民警迅速到场，将嫌疑人樊某（男，62岁，离异）当场控制。樊某在车上持刀自残，目前仍在救治中。初步查明，案件系樊某对其离婚后财产分割结果不满而引发。 #警情通报;0.00017198261529648306;2024-11-12 15:02:56
致35死43伤！珠海通报62岁男子驾车冲撞市民重大恶性案件;0.08998064019634647;2024-11-12 14:59:10
珠海驾车冲撞市民重大恶性案件造成35人死亡43人受伤，据警方通报，初步查明，案件系樊某对其离婚后财产分割结果不满而引发。#本地民生资讯;0.0021990903369843934;2024-11-12 14:59:17
#珠海  11日晚发生驾车冲撞市民重大恶性案件：35人死亡43人受伤 #权威发布;0.00048518071278676287;2024-11-12 15:22:11
珠海11日晚发生驾车冲撞市民重大恶性案件：35人死亡，43人受伤。;0.0009256883342326065;2024-11-12 15:25:14
11月12日据南方日报，珠海撞人案伤者救治情况披露：国家级专家团11人、省内专家30多名已赴珠海指导；全市5家医院300多名医护人员全力投入抢救工作。;0.0722954919580383;2024-11-12 15:25:11
#珠海警方通报  一起重大恶性案件 #社会新闻;0.0005424891175533195;2024-11-12 15:25:09
11月13日西安晚报来啦～ #本地新闻;0.0;2024-11-12 15:25:02
习近平对广东珠海市驾车冲撞行人案件作出重要指示强调，全力救治伤员，依法严惩凶手，加强风险源头防控，严防发生极端案件。（来源：央视新闻）一审：王盼琛 二审：李有余 三审：潘登;0.0010924281211866203;2024-11-12 15:24:56
#珠海  一汽车冲撞行人逃逸，62岁肇事司机被警方控制！热心市民深夜排队献血;0.010212121953640779;2024-11-12 15:24:50
珠海驾车冲撞市民重大恶性案件造成35人死亡 43人受伤   #社会新闻  #老百姓关心的话题;0.0019104273919598378;2024-11-12 15:24:41
11月12日，广东珠海，珠海警方发布珠海驾车冲撞市民重大恶性案件警情通报：案件致35人死亡，43人受伤。公安机关经综合现场勘查、视频监控、证人证言和电子证据等情况，初步查明，案件系樊某对其离婚后财产分割结果不满而引发。;0.0006573465932134597;2024-11-12 15:24:38
35人死亡 43人受伤 珠海11日晚发生驾车冲撞市民重大恶性案件 #珠海  #珠海警方通报一起重大恶性案件   #珠海体育中心  #必须严惩坏人  @快手创作者中心(O3xrgtux2ehryffe) ;0.006389263222584698;2024-11-12 15:24:32
【#珠海警方通报驾车撞倒多人事件#】#珠海驾车撞人司机已被控制# 11月11日，珠海市公安局香洲分局发布警情通报;0.00012336621405146034;2024-11-12 15:24:29
广东珠海驾车撞人事件造成35人死亡43人受伤;0.0016889420970112804;--------
11月12日，警方通报珠海发生一起驾车冲撞市民重大恶性案件，致35死43伤;0.0016808260966363388;2024-11-12 12:33:10
习近平对广东珠海市驾车冲撞行人案件作出重要指示强调，全力救治伤员，依法严惩凶手，加强风险源头防控，严防发生极端案件。（转自：央视新闻）;0.24000889344966586;2024-11-12 12:37:11
珠海驾车冲撞市民重大恶性案件造成35人死亡 43人受伤（来源：央视新闻） ;0.012377090823375859;2024-11-12 12:29:11
警方通报珠海重大恶性案件;0.0028042911148158265;2024-11-12 12:35:10
珠海11日晚发生驾车冲撞市民重大恶性案件：35人死亡，43人受伤;0.26277847092125844;2024-11-12 12:39:21
习近平对广东珠海市驾车冲撞行人案件作出重要指示;0.0006024960158987077;2024-11-12 12:39:11
珠海11日晚发生驾车冲撞市民重大恶性案件：35人死亡，43人受伤。 #突发事件;0.034503065379089655;2024-11-12 12:28:25
2024年11月11日19时48分许，珠海发生一起驾车冲撞市民重大恶性案件。12日，珠海市公安局发布警情通报，案件致35人死亡，43人受伤。（来源丨人民日报）;0.03158528468390902;2024-11-12 12:28:18
突发！致多人受伤！珠海发生驾车撞人逃逸事件，肇事司机已被警方控制。（来源：珠海公安，编辑：曹梓俊） #突发  #警情通报  #珠海;0.0005894262112938123;2024-11-12 12:27:21
广东珠海发生驾车撞人重大恶性案件 致35死43伤 #社会新闻  #重大案件;0.0010152570964420899;2024-11-12 12:26:19
珠海驾车冲撞市民重大恶性案件造成35人死亡 43人受伤;0.0;--------
珠海11日晚发生驾车冲撞市民重大恶性案件 35人死亡 43人受伤 #事故;0.0;2024-11-12 12:03:21
"珠海11日晚发生驾车冲撞市民重大恶性案件：35人死亡，43人受伤。
视频来源：央视新闻";0.001984009205344603;2024-11-12 11:47:10
2024年11月11日19时48分许，珠海发生一起驾车冲撞市民重大恶性案件。12日，珠海市公安局发布警情通报，案件致35人死亡，43人受伤。;0.00022780802510175414;2024-11-12 11:45:11
珠海11日晚发生驾车冲撞市民重大恶性案件：35人死亡 43人受伤;0.004602404145813397;2024-11-12 11:43:10
警情通报：珠海驾车冲撞市民重大恶性案件造成35人死亡 43人受伤;0.015048468921983202;2024-11-12 15:14:10
珠海警方通报一起驾车冲撞市民重大恶性案件：35人死亡 ，43人受伤！;0.00011832177804888859;2024-11-12 12:05:11
珠海警方通报一起重大恶性案件，62岁男子驾车冲撞市民，致35人死亡43人受伤;0.000518601613103736;2024-11-12 12:09:21
珠海警方通报一起重大恶性案件，已致35人死亡，43人受伤#车祸 #恶性案件;0.002244996404559128;2024-11-12 11:51:10
珠海警方通报：11日晚发生驾车冲撞市民重大恶性案件，致35人死亡43人受伤。;0.0005969335854938379;2024-11-12 11:45:21
珠海警方通报体育中心小车撞人事件;0.0006540836235263111;2024-11-12 11:57:21
"珠海发生一起驾车撞人逃逸事件， 肇事司机已被警方控制。


（来源：央视新闻）";0.008315247863587179;2024-11-12 15:01:34
珠海发生驾车冲撞市民重大恶性案件 已致35人死亡43人受伤 #珠海 #冲撞 #恶性案件 #社会 ;0.09576115317562575;2024-11-12 14:59:00
广东：全力以赴做好伤员救治和调查处置工作，举一反三开展问题排查整治。#珠海一男子驾车撞人致35死 #男司机冲撞人群 #珠海男司机冲撞人群 #珠海警方通报一起重大恶性案件;0.014759617664904329;2024-11-12 15:04:24
珠海警方通报“樊某驾车冲撞锻炼市民重大恶性案件”：致35人经抢救无效死亡、43人受伤住院治疗;8.060636234112671e-05;2024-11-12 15:21:20
习近平对广东珠海市驾车冲撞行人案件作出重要指示。;0.0;2024-11-12 15:22:39
#珠海  #警情通报  #突发  2024年11月11日19时48分许，一辆小汽车在珠海市香洲区体育中心撞倒多名行人后驾车逃逸。警方接报后迅速派员到场处置，并协助将伤者送往医院救治。目前，司机樊某（男，62岁）已被警方控制，相关调查处置工作正在加紧进行中。;0.0003514506758796893;2024-11-12 15:22:37
汽车冲入体育中心撞倒多人后逃逸，警方通报：肇事司机已被控制;0.005624069145558778;2024-11-12 15:22:30
珠海11日晚发生驾车冲撞市民重大恶性案件：35人死亡43人受伤。;0.0;2024-11-12 15:22:21
一辆小汽车撞倒多名行人后逃逸，珠海警方通报：司机已被控制;0.0007149369342412469;2024-11-12 15:22:18
珠海一辆小汽车撞倒多名行人后驾车逃逸 警方通报：司机已被控制;0.00010626271226132903;2024-11-12 15:22:17
男子驾车撞倒多人后逃逸 珠海警方通报：62岁司机已被控制;0.0;2024-11-12 15:21:39
十大消息来了 #高勋说新闻 #珠海 #有用内容创作计划 @快手热点(O3xddgkd5fav5if9);0.044167279781362145;2024-11-12 15:22:15
珠海警方通报体育中心事故：汽车撞倒多名行人后逃逸 62岁男子被控制;-5.3449841263959356e-05;2024-11-12 15:21:33
【 #62岁男子驾车撞倒多人后逃逸，珠海警方通报】11月11日，珠海市公安局香洲分局通报：2024年11月11日19时48分许，一辆小汽车在珠海市香洲区体育中心撞倒多名行人后驾车逃逸。警方接报后迅速派员到场处置，并协助将伤者送往医院救治。目前，司机樊某(男，62岁)已被警方控制，相关调查处置工作正在加紧进行中。（珠海公安）;0.01710934431785245;2024-11-12 15:22:24
11月11日 警方通报珠海一男子驾车撞倒多人 肇事司机已控制;0.0001426546866402547;2024-11-12 15:22:30
珠海大量市民深夜自发排队献血;0.004013292599154442;2024-11-12 15:21:54
警方通报小汽车在珠海市香洲区撞倒多名行人后驾车逃逸;0.0006770164467797595;2024-11-12 15:21:43
62岁男子驾车撞倒多名行人后逃逸，珠海警方通报：司机已被控制;9.03738904136909e-06;2024-11-12 15:22:19
细节关乎安全，开车时分心，这些小动作可能肇事肇祸！ #文明交通携手共创  #交通安全  #分心驾驶;0.0;2024-11-12 15:22:42
近日，广东广州，劳斯莱斯女车主被曝疑似撞车事故是“剧本”，警方回应：该案已移交交警支队处理 #劳斯莱斯  #女司机   ;0.0002536494750297215;2024-11-12 15:22:25
两司机路怒斗气扭打致1人死亡 3被告获刑：母亲拉架时被推倒后遭碾压 #路怒  #车祸;6.817996731041574e-05;--------
最高检：依法从重从严惩治重大恶性犯罪（编辑：王慧君） #法律  #珠海  #交通安全  ;0.0;2024-11-12 15:22:29
超车不规范，致四车相撞。@湖州公安;0.000405354228537982;2024-11-12 15:22:41
今天是2024年11月13日，交口新闻早班车来了！;0.0;2024-11-12 15:23:33
珠海警方通报一起重大恶性案件;0.00038237274774252986;2024-11-12 15:23:02
事故预防|过路口都还在玩手机 当场撞飞电动车 #事故预防  #分心驾驶 ;0.0;2024-11-12 15:22:17
运气还是车技?失控小车横穿繁忙7车道，却丝毫没有撞毁任何物品......;0.0;2024-11-12 15:23:53
